{
  "$schema": "https://json-schema.org/draft/2020-12/schema",
  "$id": "https://github.com/lgdeysel1980/BookAtrium/registries/schemas/official-plugin-manifest.schema.json",
  "title": "Official BookAtrium Plugin Package Manifest",
  "description": "Source package manifest under Plugins/Official/.../src/.../plugin.json. Distinct from the registry index entry in registries/official-plugins.json.",
  "type": "object",
  "additionalProperties": false,
  "required": [
    "manifestVersion",
    "id",
    "name",
    "version",
    "pluginType",
    "pluginApiVersion",
    "entryAssembly",
    "entryType",
    "capabilities",
    "license"
  ],
  "properties": {
    "manifestVersion": {
      "const": 1
    },
    "id": {
      "type": "string",
      "pattern": "^[a-z0-9]([a-z0-9.\\-]{0,126}[a-z0-9])?$"
    },
    "name": {
      "type": "string",
      "minLength": 1,
      "maxLength": 200
    },
    "description": {
      "type": "string",
      "maxLength": 4000
    },
    "version": {
      "type": "string",
      "pattern": "^\\d+\\.\\d+\\.\\d+(?:-[0-9A-Za-z.-]+)?(?:\\+[0-9A-Za-z.-]+)?$"
    },
    "author": {
      "type": [
        "string",
        "null"
      ],
      "maxLength": 200
    },
    "publisher": {
      "type": [
        "string",
        "null"
      ],
      "maxLength": 200
    },
    "homepage": {
      "type": [
        "string",
        "null"
      ]
    },
    "supportUrl": {
      "type": [
        "string",
        "null"
      ]
    },
    "license": {
      "type": "string",
      "minLength": 1,
      "maxLength": 128
    },
    "pluginType": {
      "type": "string",
      "enum": [
        "ConversionInput",
        "ConversionOutput",
        "DeviceInterface",
        "MetadataReader",
        "MetadataSource",
        "MetadataWriter",
        "Store",
        "FileType",
        "InputProfile",
        "OutputProfile",
        "AuthorMetadataSource"
      ]
    },
    "pluginApiVersion": {
      "type": "string",
      "enum": [
        "2.0"
      ]
    },
    "contractApiVersion": {
      "anyOf": [
        {
          "type": "string",
          "enum": [
            "2.0",
            "1.0",
            "1.1"
          ]
        },
        {
          "type": "null"
        }
      ]
    },
    "minimumAppVersion": {
      "type": "string",
      "pattern": "^\\d+\\.\\d+\\.\\d+(?:-[0-9A-Za-z.-]+)?(?:\\+[0-9A-Za-z.-]+)?$"
    },
    "maximumAppVersion": {
      "type": [
        "string",
        "null"
      ]
    },
    "targetFramework": {
      "type": [
        "string",
        "null"
      ]
    },
    "supportedPlatforms": {
      "type": "array",
      "maxItems": 16,
      "items": {
        "type": "string",
        "enum": [
          "windows-x64",
          "windows-x86",
          "windows-arm64",
          "windows",
          "any"
        ]
      }
    },
    "entryAssembly": {
      "type": "string",
      "minLength": 1,
      "maxLength": 260,
      "pattern": "^(?!.*\\.\\.)(?!/).+\\.dll$"
    },
    "entryType": {
      "type": "string",
      "minLength": 1,
      "maxLength": 512
    },
    "capabilities": {
      "type": "array",
      "minItems": 1,
      "maxItems": 64,
      "items": {
        "type": "string",
        "enum": [
          "NetworkAccess",
          "PluginSettingsStorage",
          "TemporaryFileAccess",
          "ReadBookMetadata",
          "WriteBookMetadata",
          "ReadInputFormat",
          "ProduceOutputFormat",
          "DetectDevice",
          "TransferToDevice",
          "StoreSearch",
          "CoverDownload",
          "MetadataLookup",
          "DeclareFileTypes",
          "DeclareInputProfiles",
          "DeclareOutputProfiles",
          "SearchByTitleAuthor",
          "SearchByIsbn",
          "SearchByExternalIdentifier",
          "CoverSearch",
          "MetadataEnrichment",
          "MultipleLanguages",
          "SeriesMetadata",
          "Description",
          "Publisher",
          "PublicationDate",
          "TagsSubjects",
          "Ratings",
          "Identifiers"
        ]
      }
    },
    "requiresRestart": {
      "type": "boolean"
    },
    "configurable": {
      "type": [
        "boolean",
        "null"
      ]
    },
    "settingsSchema": {
      "type": [
        "array",
        "null"
      ]
    },
    "requiredSecrets": {
      "type": "array",
      "items": {
        "type": "string"
      }
    },
    "defaultEnabled": {
      "type": "boolean"
    },
    "networkHosts": {
      "type": "array",
      "maxItems": 32,
      "items": {
        "type": "string",
        "minLength": 1,
        "maxLength": 253
      }
    },
    "contentTypes": {
      "type": "array",
      "items": {
        "type": "string"
      }
    },
    "icon": {
      "type": [
        "string",
        "null"
      ]
    },
    "releaseNotes": {
      "type": [
        "string",
        "null"
      ]
    }
  }
}
