{
  "manifestVersion": 1,
  "id": "com.practicore.bookatrium.metadatasource.amazon-co-uk",
  "name": "Amazon.co.uk, UK",
  "description": "Searches Amazon.co.uk, UK book detail pages for title, author, identifiers, cover, series, ratings, publisher, date, language, and tags.",
  "version": "1.0.0",
  "publisher": "PractiCore",
  "author": "PractiCore",
  "license": "MIT",
  "pluginType": "MetadataSource",
  "pluginApiVersion": "2.0",
  "minimumAppVersion": "1.0.0",
  "targetFramework": "net10.0",
  "entryAssembly": "BookAtrium.Plugins.AmazonCoUk.dll",
  "entryType": "BookAtrium.Plugins.AmazonCoUk.Plugin",
  "capabilities": [
    "SearchByTitleAuthor",
    "SearchByIsbn",
    "SearchByExternalIdentifier",
    "CoverSearch",
    "Description",
    "Identifiers",
    "SeriesMetadata",
    "Ratings",
    "Publisher",
    "PublicationDate",
    "TagsSubjects",
    "NetworkAccess",
    "MetadataLookup",
    "CoverDownload"
  ],
  "requiresRestart": false,
  "defaultEnabled": true,
  "networkHosts": [ "www.amazon.co.uk" ]
}
