{
  "manifestVersion": 1,
  "id": "com.practicore.bookatrium.conversioninput.epub",
  "name": "EPUB Conversion Input",
  "description": "Reads EPUB packages (OPF manifest, spine, and resources) into the BookAtrium conversion intermediate representation.",
  "version": "1.0.0",
  "publisher": "PractiCore",
  "author": "PractiCore",
  "license": "MIT",
  "pluginType": "ConversionInput",
  "pluginApiVersion": "2.0",
  "minimumAppVersion": "1.0.0",
  "targetFramework": "net10.0",
  "supportedPlatforms": [ "windows" ],
  "entryAssembly": "BookAtrium.Plugins.EpubConversionInput.dll",
  "entryType": "BookAtrium.Plugins.EpubConversionInput.Plugin",
  "capabilities": [ "ReadInputFormat", "TemporaryFileAccess" ],
  "requiresRestart": false,
  "defaultEnabled": true,
  "contentTypes": [ "epub" ]
}
