{
  "manifestVersion": 1,
  "id": "com.practicore.bookatrium.output-profiles.core",
  "name": "Core Output Profiles",
  "description": "Standard EPUB and Kobo KEPUB output recommendations.",
  "version": "1.0.0",
  "publisher": "PractiCore",
  "author": "PractiCore",
  "license": "MIT",
  "pluginType": "OutputProfile",
  "pluginApiVersion": "2.0",
  "minimumAppVersion": "1.0.0",
  "targetFramework": "net10.0",
  "supportedPlatforms": [ "windows" ],
  "entryAssembly": "BookAtrium.Plugins.CoreOutputProfiles.dll",
  "entryType": "BookAtrium.Plugins.CoreOutputProfiles.Plugin",
  "capabilities": [ "DeclareOutputProfiles" ],
  "requiresRestart": false,
  "defaultEnabled": true,
  "contentTypes": [ "epub", "kepub" ]
}
