{
  "manifestVersion": 1,
  "id": "com.practicore.bookatrium.conversionoutput.azw3",
  "name": "AZW3 Conversion Output",
  "description": "Writes the BookAtrium conversion intermediate representation to a KF8 (AZW3) PalmDOC/MOBI container.",
  "version": "1.0.0",
  "publisher": "PractiCore",
  "author": "PractiCore",
  "license": "MIT",
  "pluginType": "ConversionOutput",
  "pluginApiVersion": "2.0",
  "minimumAppVersion": "1.0.0",
  "targetFramework": "net10.0",
  "supportedPlatforms": [ "windows" ],
  "entryAssembly": "BookAtrium.Plugins.Azw3ConversionOutput.dll",
  "entryType": "BookAtrium.Plugins.Azw3ConversionOutput.Plugin",
  "capabilities": [ "ProduceOutputFormat", "TemporaryFileAccess" ],
  "requiresRestart": false,
  "defaultEnabled": true,
  "contentTypes": [ "azw3" ]
}
